{
  "$schema": "https://json-schema.org/draft/2020-12/schema",
  "$id": "https://github.com/eightraw/rt-dspplr/blob/main/packages/rt-dspplr/schema/manifest.schema.json",
  "title": "RT-DSPPLR prepared-audio manifest",
  "description": "manifest.json of a prepared recording (formatVersion 4). Normative text: docs/manifest.md. Unknown properties are allowed and ignored by players.",
  "type": "object",
  "required": [
    "format",
    "formatVersion",
    "analyzerVersion",
    "id",
    "createdAt",
    "duration",
    "sampleRate",
    "sourceSampleRate",
    "channels",
    "frames",
    "source",
    "segments",
    "peaks",
    "loudness"
  ],
  "properties": {
    "format": { "const": "rtd-audio-manifest" },
    "formatVersion": { "const": 4 },
    "analyzerVersion": { "type": "string" },
    "revision": { "type": "integer", "minimum": 1 },
    "id": { "type": "string", "description": "sha256:<hex> of the source file's bytes" },
    "createdAt": { "type": "string" },
    "duration": { "type": "number", "minimum": 0, "description": "seconds: frames / sampleRate" },
    "sampleRate": { "$ref": "#/$defs/sampleRate", "description": "Hz, of segments, peaks and analyses" },
    "sourceSampleRate": { "$ref": "#/$defs/sampleRate" },
    "channels": { "$ref": "#/$defs/channels" },
    "frames": { "$ref": "#/$defs/count" },
    "source": {
      "type": "object",
      "required": ["name", "bytes", "encoding", "bitsPerSample", "frames"],
      "properties": {
        "name": { "type": ["string", "null"] },
        "bytes": { "$ref": "#/$defs/count" },
        "encoding": { "type": "string" },
        "bitsPerSample": { "$ref": "#/$defs/positiveInteger" },
        "frames": { "$ref": "#/$defs/count" }
      }
    },
    "segments": { "$ref": "#/$defs/segments" },
    "peaks": { "$ref": "#/$defs/peaks" },
    "loudness": { "$ref": "#/$defs/loudness" },
    "bands": { "$ref": "#/$defs/bands" },
    "spectrogram": { "$ref": "#/$defs/spectrogram" },
    "stems": {
      "type": "object",
      "description": "v3: named stems on the source's grid. Keys are opaque, host-chosen ids; 'b' is the default key.",
      "propertyNames": { "$ref": "#/$defs/stemKey" },
      "additionalProperties": { "$ref": "#/$defs/stem" }
    }
  },
  "$defs": {
    "count": { "type": "integer", "minimum": 0 },
    "positiveInteger": { "type": "integer", "minimum": 1 },
    "sampleRate": { "type": "integer", "minimum": 8000, "maximum": 384000, "description": "Hz (MIN_SAMPLE_RATE to MAX_SAMPLE_RATE)" },
    "channels": { "type": "integer", "minimum": 1, "maximum": 32, "description": "1 to MAX_CHANNELS" },
    "stemKey": {
      "type": "string",
      "pattern": "^[A-Za-z0-9][A-Za-z0-9_-]{0,31}$",
      "not": { "enum": ["a", "A"] },
      "description": "1-32 of [A-Za-z0-9_-], starting with a letter or digit; 'a' is reserved for the source. Keys must not collide case-insensitively (not expressible here; checked by assertManifest)."
    },
    "source": {
      "type": "object",
      "description": "The audio file the segments index: the original as it was given, or a WAV made from a format the player does not decode.",
      "required": ["url", "bytes", "codec", "sampleRate", "channels"],
      "properties": {
        "url": { "type": "string", "description": "relative to the manifest's URL (or absolute); fetched with HTTP Range requests" },
        "bytes": { "$ref": "#/$defs/count" },
        "codec": { "enum": ["wav", "mp3", "flac", "opus"] },
        "sampleRate": { "$ref": "#/$defs/sampleRate", "description": "for A the timeline's; for a stem A's (checked by assertManifest)" },
        "channels": { "$ref": "#/$defs/channels", "description": "for A the timeline's; for a stem A's or 1 (checked by assertManifest)" },
        "pcm": {
          "type": "object",
          "description": "wav: the layout of its samples",
          "required": ["encoding", "bitsPerSample", "blockAlign"],
          "properties": {
            "encoding": { "enum": ["int", "float"] },
            "bitsPerSample": { "type": "integer", "minimum": 8 },
            "blockAlign": { "$ref": "#/$defs/positiveInteger" }
          }
        },
        "header": { "type": "string", "description": "flac and opus: the stream's header (base64), put before a run to decode it" }
      },
      "allOf": [
        { "if": { "properties": { "codec": { "const": "wav" } } }, "then": { "required": ["pcm"] } },
        { "if": { "properties": { "codec": { "enum": ["flac", "opus"] } } }, "then": { "required": ["header"] } },
        { "if": { "properties": { "codec": { "const": "opus" } } }, "then": { "properties": { "sampleRate": { "const": 48000 } } } }
      ]
    },
    "segments": {
      "type": "object",
      "description": "A segment list, one column each, in timeline order: segment i covers frames [i × framesPerSegment, min((i + 1) × framesPerSegment, frames)) of the timeline. Every column has one entry a segment (ranges two): checked by assertManifest, as the schema cannot count them.",
      "required": ["framesPerSegment", "source", "ranges", "tail"],
      "properties": {
        "framesPerSegment": { "$ref": "#/$defs/positiveInteger", "description": "at most MAX_SEGMENT_SECONDS (60) × sampleRate (checked by assertManifest)" },
        "source": { "$ref": "#/$defs/source" },
        "ranges": { "type": "array", "items": { "$ref": "#/$defs/count" }, "description": "two numbers a segment: the bytes [start, end) of the source decoded as one run; [0, 0]: the segment is silence" },
        "tail": { "type": "array", "items": { "$ref": "#/$defs/count" }, "description": "the run's samples from the segment's first to the run's end" },
        "skip": { "type": "array", "items": { "$ref": "#/$defs/count" }, "description": "MP3, FLAC and Opus runs: the run's decoded samples before the segment's first (skip + tail are all of them); absent: decode the runs whole first" },
        "lead": { "type": "array", "items": { "$ref": "#/$defs/count" }, "description": "frames of silence before the source's samples" },
        "trail": { "type": "array", "items": { "$ref": "#/$defs/count" }, "description": "frames of silence after them" },
        "entries": {
          "type": "object",
          "description": "MP3, FLAC, Opus: entries.bin, where runs may start inside the segments (for seeks)",
          "required": ["url", "bytes"],
          "properties": { "url": { "type": "string" }, "bytes": { "$ref": "#/$defs/count" } }
        }
      }
    },
    "peaks": {
      "type": "object",
      "required": ["url", "bytes", "format", "version", "levels"],
      "properties": {
        "url": { "type": "string" },
        "bytes": { "$ref": "#/$defs/count" },
        "format": { "const": "rtd-peaks" },
        "version": { "$ref": "#/$defs/positiveInteger" },
        "encoding": { "const": "int16-min-max-rms" },
        "levels": {
          "type": "array",
          "items": {
            "type": "object",
            "required": ["framesPerPeak", "peaks", "byteOffset", "byteLength"],
            "properties": {
              "framesPerPeak": { "$ref": "#/$defs/positiveInteger" },
              "peaks": { "$ref": "#/$defs/count" },
              "byteOffset": { "$ref": "#/$defs/count" },
              "byteLength": { "$ref": "#/$defs/count" }
            }
          }
        }
      }
    },
    "loudness": {
      "type": "object",
      "required": ["peak", "peakDb", "rmsDb", "gatedRmsDb", "perChannel"],
      "properties": {
        "peak": { "type": "number" },
        "peakDb": { "type": "number" },
        "rmsDb": { "type": "number" },
        "gatedRmsDb": { "type": "number" },
        "perChannel": {
          "type": "array",
          "items": {
            "type": "object",
            "properties": { "peakDb": { "type": "number" }, "rmsDb": { "type": "number" } }
          }
        }
      }
    },
    "bands": {
      "type": "object",
      "required": ["url", "bytes", "format", "version"],
      "properties": {
        "url": { "type": "string" },
        "bytes": { "$ref": "#/$defs/count" },
        "format": { "const": "rtd-bands" },
        "version": { "$ref": "#/$defs/positiveInteger" },
        "framesPerBin": { "$ref": "#/$defs/positiveInteger" },
        "bins": { "$ref": "#/$defs/count" },
        "cutoffsHz": { "type": "array", "items": { "type": "number" } }
      }
    },
    "spectrogram": {
      "type": "object",
      "required": ["url", "bytes", "format", "version"],
      "properties": {
        "url": { "type": "string" },
        "bytes": { "$ref": "#/$defs/count" },
        "format": { "const": "rtd-spectrogram" },
        "version": { "$ref": "#/$defs/positiveInteger" },
        "rows": { "$ref": "#/$defs/positiveInteger" },
        "minHz": { "type": "number" },
        "maxHz": { "type": "number" },
        "topDb": { "type": "number" },
        "rangeDb": { "type": "number" },
        "levels": {
          "type": "array",
          "items": {
            "type": "object",
            "properties": {
              "framesPerColumn": { "$ref": "#/$defs/positiveInteger" },
              "columns": { "$ref": "#/$defs/count" },
              "byteOffset": { "$ref": "#/$defs/count" },
              "byteLength": { "$ref": "#/$defs/count" }
            }
          }
        }
      }
    },
    "stem": {
      "type": "object",
      "required": ["status", "updatedAt"],
      "properties": {
        "status": { "enum": ["processing", "ready", "failed"] },
        "label": { "type": "string", "minLength": 1, "maxLength": 120, "description": "human name for interfaces; never interpreted" },
        "error": { "type": "string" },
        "updatedAt": { "type": "string" },
        "aSourceId": { "type": "string" },
        "processor": {
          "type": "object",
          "required": ["id", "version"],
          "properties": {
            "id": { "type": "string" },
            "version": { "type": "string" },
            "params": { "type": "object" },
            "durationMs": { "type": "number" }
          }
        },
        "id": { "type": "string" },
        "source": {
          "type": "object",
          "properties": {
            "name": { "type": ["string", "null"] },
            "bytes": { "$ref": "#/$defs/count" },
            "sampleRate": { "$ref": "#/$defs/positiveInteger" },
            "channels": { "$ref": "#/$defs/positiveInteger" },
            "frames": { "$ref": "#/$defs/count" },
            "bandwidthHz": { "type": "number" }
          }
        },
        "alignment": {
          "type": "object",
          "properties": {
            "offsetFrames": { "type": "integer" },
            "offsetMs": { "type": "number" },
            "confidence": { "type": "number" },
            "windows": { "$ref": "#/$defs/count" },
            "agreeing": { "$ref": "#/$defs/count" }
          }
        },
        "correlation": {
          "type": "object",
          "properties": {
            "global": { "type": "number" },
            "perSegment": { "type": "array", "items": { "type": "number" } }
          }
        },
        "mixLaw": { "enum": ["crossfade", "equal-power"] },
        "loudnessDeltaDb": { "type": "number" },
        "gainDb": { "type": "number", "minimum": -60, "maximum": 12 },
        "loudness": { "$ref": "#/$defs/loudness" },
        "segments": { "$ref": "#/$defs/segments" },
        "peaks": { "$ref": "#/$defs/peaks" },
        "bands": { "$ref": "#/$defs/bands" },
        "spectrogram": { "$ref": "#/$defs/spectrogram" }
      },
      "if": { "properties": { "status": { "const": "ready" } } },
      "then": { "required": ["segments", "peaks"] }
    }
  }
}
